{
  "$schema": "./agent-catalog.schema.json",
  "schemaVersion": "paperclip-executive.agent-catalog.v1",
  "catalogVersion": "1.0.0",
  "sourceContract": {
    "repository": "paperclip",
    "commit": "61b3fd57a695614dc4a37e2303f426a34a9795cf"
  },
  "agents": [
    {
      "profileId": "software-executor",
      "profileVersion": "1.0.0",
      "instructionsSource": "profiles/software-executor/AGENTS.md",
      "lifecycle": { "defaultState": "paused", "automaticProvisioning": false, "automaticActivation": false },
      "nativeHireDraft": {
        "name": "Software Executor", "role": "engineer", "title": "Software Executor",
        "capabilities": "Implements bounded software tickets and returns replayable evidence for independent review.",
        "desiredSkills": ["paperclip-executive.implementation-execution"],
        "adapterType": "codex_local",
        "adapterConfig": { "engine": "acp", "model": "gpt-6-sol", "modelReasoningEffort": "high", "mode": "persistent", "nonInteractivePermissions": "deny" },
        "runtimeConfig": { "heartbeat": { "enabled": false, "wakeOnDemand": false } },
        "budgetMonthlyCents": 0,
        "permissions": { "canCreateAgents": false, "canCreateSkills": false }
      },
      "nativePermissionPatch": { "canCreateAgents": false, "canCreateSkills": false, "canAssignTasks": false },
      "requirements": {
        "workspace": "isolated-project-write",
        "tools": ["Paperclip issue read/comment", "scoped repository filesystem and Git", "project validation commands"],
        "authentication": ["distinct Paperclip agent identity", "operator-selected Codex provider binding", "repository credentials only when explicitly required"],
        "authorization": ["assigned ticket", "bounded write scope", "separate approval for publish, deploy, or external effects"]
      },
      "skills": [{ "key": "paperclip-executive.implementation-execution", "version": "1.0.0", "assignment": "required" }, { "key": "paperclip-executive.risk-review", "version": "1.0.0", "assignment": "conditional" }, { "key": "paperclip-executive.evidence-review", "version": "1.0.0", "assignment": "conditional" }]
    },
    {
      "profileId": "council-reviewer", "profileVersion": "1.0.0", "instructionsSource": "profiles/council-reviewer/AGENTS.md",
      "lifecycle": { "defaultState": "paused", "automaticProvisioning": false, "automaticActivation": false },
      "nativeHireDraft": {
        "name": "Council Reviewer", "role": "general", "title": "Generalist Council Reviewer",
        "capabilities": "Synthesizes specialist evidence and records a Council decision within the granted mandate.",
        "desiredSkills": ["paperclip-executive.council-decision-review"], "adapterType": "codex_local",
        "adapterConfig": { "engine": "acp", "model": "gpt-6-astra", "modelReasoningEffort": "high", "mode": "persistent", "nonInteractivePermissions": "deny" },
        "runtimeConfig": { "heartbeat": { "enabled": false, "wakeOnDemand": false } }, "budgetMonthlyCents": 0,
        "permissions": { "canCreateAgents": false, "canCreateSkills": false }
      },
      "nativePermissionPatch": { "canCreateAgents": false, "canCreateSkills": false, "canAssignTasks": false },
      "requirements": { "workspace": "project-read-only", "tools": ["Paperclip issue, decision, and work-product readback"], "authentication": ["distinct Paperclip agent identity", "operator-selected Codex provider binding"], "authorization": ["explicit Council mandate", "decision write only through the authorized Council surface"] },
      "skills": [{ "key": "paperclip-executive.council-decision-review", "version": "1.0.0", "assignment": "required" }, { "key": "paperclip-executive.evidence-review", "version": "1.0.0", "assignment": "conditional" }, { "key": "paperclip-executive.risk-review", "version": "1.0.0", "assignment": "conditional" }]
    },
    {
      "profileId": "executive", "profileVersion": "1.1.0", "instructionsSource": "profiles/executive/AGENTS.md",
      "lifecycle": { "defaultState": "paused", "automaticProvisioning": false, "automaticActivation": false },
      "nativeHireDraft": {
        "name": "Executive Advisor", "role": "general", "title": "Executive Advisor",
        "capabilities": "Provides bounded executive advice and prepared-ticket contributions without decision authority.",
        "desiredSkills": ["paperclip-executive.direct-advice", "paperclip-executive.prepared-ticket-review"], "adapterType": "codex_local",
        "adapterConfig": { "engine": "acp", "model": "gpt-6-sol", "modelReasoningEffort": "high", "mode": "persistent", "nonInteractivePermissions": "deny" },
        "runtimeConfig": { "heartbeat": { "enabled": false, "wakeOnDemand": false } }, "budgetMonthlyCents": 0,
        "permissions": { "canCreateAgents": false, "canCreateSkills": false }
      },
      "nativePermissionPatch": { "canCreateAgents": false, "canCreateSkills": false, "canAssignTasks": false },
      "requirements": { "workspace": "none", "tools": ["Paperclip session input and attributable result persistence"], "authentication": ["distinct Paperclip agent identity", "operator-selected Codex provider binding"], "authorization": ["explicit consultation request", "no external action authority"] },
      "skills": [{ "key": "paperclip-executive.direct-advice", "version": "1.0.0", "assignment": "required" }, { "key": "paperclip-executive.prepared-ticket-review", "version": "1.0.0", "assignment": "required" }, { "key": "paperclip-executive.stakeholder-communication", "version": "1.0.0", "assignment": "conditional" }]
    },
    {
      "profileId": "product", "profileVersion": "1.0.0", "instructionsSource": "profiles/product/AGENTS.md",
      "lifecycle": { "defaultState": "paused", "automaticProvisioning": false, "automaticActivation": false },
      "nativeHireDraft": { "name": "Product Advisor", "role": "pm", "title": "Product and CPO Advisor", "capabilities": "Assesses user value, scope, acceptance criteria, and product risk for prepared tickets.", "desiredSkills": ["paperclip-executive.specialist-advisory"], "adapterType": "codex_local", "adapterConfig": { "engine": "acp", "model": "gpt-5.6-sol", "modelReasoningEffort": "medium", "mode": "oneshot", "nonInteractivePermissions": "deny" }, "runtimeConfig": { "heartbeat": { "enabled": false, "wakeOnDemand": false } }, "budgetMonthlyCents": 0, "permissions": { "canCreateAgents": false, "canCreateSkills": false } },
      "nativePermissionPatch": { "canCreateAgents": false, "canCreateSkills": false, "canAssignTasks": false },
      "requirements": { "workspace": "project-read-only", "tools": ["Paperclip ticket and evidence read"], "authentication": ["distinct Paperclip agent identity", "operator-selected Codex provider binding"], "authorization": ["advisory output only"] },
      "skills": [{ "key": "paperclip-executive.specialist-advisory", "version": "1.0.0", "assignment": "required" }, { "key": "paperclip-executive.prepared-ticket-review", "version": "1.0.0", "assignment": "conditional" }, { "key": "paperclip-executive.evidence-review", "version": "1.0.0", "assignment": "conditional" }, { "key": "paperclip-executive.stakeholder-communication", "version": "1.0.0", "assignment": "conditional" }]
    },
    {
      "profileId": "architecture", "profileVersion": "1.0.0", "instructionsSource": "profiles/architecture/AGENTS.md",
      "lifecycle": { "defaultState": "paused", "automaticProvisioning": false, "automaticActivation": false },
      "nativeHireDraft": { "name": "Architecture Advisor", "role": "cto", "title": "Architecture and Engineering Advisor", "capabilities": "Assesses technical design, interfaces, operability, and implementation feasibility.", "desiredSkills": ["paperclip-executive.specialist-advisory"], "adapterType": "codex_local", "adapterConfig": { "engine": "acp", "model": "gpt-6-sol", "modelReasoningEffort": "high", "mode": "oneshot", "nonInteractivePermissions": "deny" }, "runtimeConfig": { "heartbeat": { "enabled": false, "wakeOnDemand": false } }, "budgetMonthlyCents": 0, "permissions": { "canCreateAgents": false, "canCreateSkills": false } },
      "nativePermissionPatch": { "canCreateAgents": false, "canCreateSkills": false, "canAssignTasks": false },
      "requirements": { "workspace": "project-read-only", "tools": ["Paperclip ticket/evidence read", "read-only repository inspection"], "authentication": ["distinct Paperclip agent identity", "operator-selected Codex provider binding"], "authorization": ["advisory output only"] },
      "skills": [{ "key": "paperclip-executive.specialist-advisory", "version": "1.0.0", "assignment": "required" }, { "key": "paperclip-executive.prepared-ticket-review", "version": "1.0.0", "assignment": "conditional" }, { "key": "paperclip-executive.risk-review", "version": "1.0.0", "assignment": "conditional" }]
    },
    {
      "profileId": "quality", "profileVersion": "1.0.0", "instructionsSource": "profiles/quality/AGENTS.md",
      "lifecycle": { "defaultState": "paused", "automaticProvisioning": false, "automaticActivation": false },
      "nativeHireDraft": { "name": "Quality Advisor", "role": "qa", "title": "Quality and QA Advisor", "capabilities": "Assesses acceptance coverage, regressions, test evidence, and residual quality risk.", "desiredSkills": ["paperclip-executive.specialist-advisory", "paperclip-executive.evidence-review"], "adapterType": "codex_local", "adapterConfig": { "engine": "acp", "model": "gpt-5.6-sol", "modelReasoningEffort": "medium", "mode": "oneshot", "nonInteractivePermissions": "deny" }, "runtimeConfig": { "heartbeat": { "enabled": false, "wakeOnDemand": false } }, "budgetMonthlyCents": 0, "permissions": { "canCreateAgents": false, "canCreateSkills": false } },
      "nativePermissionPatch": { "canCreateAgents": false, "canCreateSkills": false, "canAssignTasks": false },